{"canonicalPayloadDigest":"sha256:b0302e7ece568675d3eab74f5f8a4a31ede468438815d0aab433dbcc8e04684d","counts":{"analysisFacts":114,"feedback":0,"labelClusters":1,"machineValidations":3,"managedReleases":2,"mappingCandidates":2,"releaseFacts":16,"searchOnlyMappings":1},"format":"refspec-vocabulary-atlas-nquads-1.0","generationDigest":"sha256:f7765c7a0d2bad98aeee2eaec910dc7ed9389b8fcbbef761b7ef641000ffeaec","graphs":[{"id":"urn:ref:vocabulary-atlas:f7765c7a0d2bad98aeee2eaec910dc7ed9389b8fcbbef761b7ef641000ffeaec:release-facts","quadCount":16,"role":"releaseFacts"},{"id":"urn:ref:vocabulary-atlas:f7765c7a0d2bad98aeee2eaec910dc7ed9389b8fcbbef761b7ef641000ffeaec:analysis","quadCount":114,"role":"analysis"}],"id":"urn:ref:vocabulary-atlas:f7765c7a0d2bad98aeee2eaec910dc7ed9389b8fcbbef761b7ef641000ffeaec","implementation":{"id":"urn:ref:implementation:vocabulary-atlas:1.0","runtime":{"jsonschemaVersion":"4.26.0","pyarrowVersion":"23.0.0","pythonRequirement":">=3.10","pythonVersion":"3.12.9","rdflibVersion":"7.6.0"},"sourceModules":[{"digest":"sha256:45fc1b96e41a57aa704f4397a2abb62039a68545e757c80fb0e932a09ee2dda2","path":"refspec/atlas/__init__.py"},{"digest":"sha256:6782140a8fa16e83add9e080b6796dbd6909749a2f71c3a96f9df9cda27352c1","path":"refspec/atlas/federal_register.py"},{"digest":"sha256:8f6977349fe6b5c971619f50900bf461322ffe0ae603c6da4ece0ae31f275617","path":"refspec/atlas/icpsr.py"},{"digest":"sha256:d7af5aae9e0e0c0bdae7c7fc5867baa87b3dcfd024c95ed20f3500af2d23f30d","path":"refspec/atlas/model.py"},{"digest":"sha256:dcdc918577b2a87f39d6b9d3ed28d1c877827174e979242affaf6df1d0216d89","path":"refspec/atlas/queries.py"},{"digest":"sha256:f6c7fc85e27852c124580969f9cbda6b5a7e7aa8502fbd4b9ea14867b95c130b","path":"refspec/binding.py"},{"digest":"sha256:9caed4aa1acd1aef685274b4c2dabee4f23dbae1d940a790612cf346f0f7f05a","path":"refspec/generated_rulespec_dependency.py"},{"digest":"sha256:639eb8483d3ffbac303ca07ef90aa76717e6ac2f6bfc993eea31873f6b025bcb","path":"refspec/immutable.py"},{"digest":"sha256:e60729e8ddbcf263866ac27788aaf6090da4d1cfddb3add02db5c9fa1eeda304","path":"refspec/managed_release.py"},{"digest":"sha256:b43497b238f1ae08675fcfdc8a44cdf717381b92e3ae612909c8993ef8cefd85","path":"refspec/registry/controlled_identifier.py"},{"digest":"sha256:c32602e9ee059356e97e9cf2ff10875b919113b68c8ee88ce6b8ac256237ba1d","path":"refspec/registry/federal_register_thesaurus.py"},{"digest":"sha256:7a6ec0bb4e39cd8ab469587ee1e82c38741a6ccc2324ee75b9c9c1ae06ac02c7","path":"refspec/registry/federal_register_thesaurus_2025.py"},{"digest":"sha256:dcdc9a8074a335765495987b8a45e26261f1c522cf2ad79b93b79b6560f1ec02","path":"refspec/registry/federal_register_thesaurus_2025_managed_release.py"},{"digest":"sha256:5e2198df6f109e4798a970b7c6f6296bc4d20af26731b3fdfff0f261ce51ae6d","path":"refspec/registry/federal_register_vocabulary_policy.py"},{"digest":"sha256:6ad79d17be55b092f68ac822380becc55f866973ea9134429347927cadadbf65","path":"refspec/registry/icpsr_managed_release.py"},{"digest":"sha256:36af6de76906d04e40dc25a3032cc69e214f7c872db8883f66450ed5d5d392c0","path":"refspec/registry/icpsr_subject.py"},{"digest":"sha256:9b1e638e963bcaf72e50b88b6c161316a4050946a6a612950ae29620a534766d","path":"refspec/release_graph.py"},{"digest":"sha256:223f47142e747dc2a8ea3bcb04264d1c313f58d42499490956403539b3a8839e","path":"refspec/storage.py"},{"digest":"sha256:74b969f71762060e5070c8e875cb16894c37494c9aa8e230e2fd9acfa7fae31a","path":"refspec/vocabulary.py"}],"version":"1.0"},"inputs":[{"manifestDigest":"sha256:1111111111111111111111111111111111111111111111111111111111111111","publicationReleaseId":"urn:ref:conformance:alpha-thesaurus:2026","role":"ManagedReleaseView","rulespecGraph":{"digest":"sha256:4acf4b1a5b7c14054fd49893b98f9295d0a99f215e0eac0d9e0d8630210fefc0","id":"urn:ref:conformance:alpha-thesaurus:2026:graph"}},{"manifestDigest":"sha256:2222222222222222222222222222222222222222222222222222222222222222","publicationReleaseId":"urn:ref:conformance:beta-thesaurus:2026","role":"ManagedReleaseView","rulespecGraph":{"digest":"sha256:21b637d5b5583fc4a82dc637a74f8a8034e2df111d59871286205d6e08b717c1","id":"urn:ref:conformance:beta-thesaurus:2026:graph"}},{"fileDigest":"sha256:69fb95b1011f502bb528747d99c90a6594fb20048a2bfc0973936da03434da25","releaseDigest":"sha256:d4d9d6f1b7a1e290dbe12fcd12be4c00c233c00b741f2cb5b7f24f5b15ddd4b0","releaseId":"urn:rulespec:core:d4d9d6f1b7a1e290dbe12fcd12be4c00c233c00b741f2cb5b7f24f5b15ddd4b0","role":"RulespecCoreRelease"},{"digest":"sha256:c6e59c37f3277e2acd5742967d9f237b4b47f9a6d23a1a1919d777f88ffe2508","fileDigest":"sha256:6b9e5e5f6fca7497dfac252fe8f3782c3b0456783f5deaf16d1ffb5c25abd988","id":"urn:ref:vocabulary-atlas-crosswalk-bundle:6d0ce8f222850a325f495a1923784e41cf879c41cba8f610a7c2e651def51829","mediaType":"application/vnd.refspec.vocabulary-atlas-crosswalk+json","role":"CrosswalkBundle"}],"output":{"byteLength":41133,"digest":"sha256:fdcc66d3d2947311f9210c63d9e4d1dc050dbd3c921dc890615faaed0af9a783","mediaType":"application/n-quads","path":"atlas.nq","quadCount":130},"policies":{"analysis":"replaceableMachineAnalysis","humanFeedback":"appendOnlyNonAuthorizing","labelEquality":"clusterOnly","mappingEligibility":"twoIndependentMachinesSearchOnly","releaseFacts":"copiedManagedReleaseFactsOnly"},"schemaVersion":"1.0","type":"urn:ref:type:VocabularyAtlasManifest"}
