{"canonicalPayloadDigest":"sha256:1b5fcca9f0d2d12d3272298396f82e7acfc9be371058e864423844dfa12bdaac","counts":{"analysisFacts":475,"feedback":0,"labelClusters":2,"machineValidations":14,"managedReleases":2,"mappingCandidates":7,"releaseFacts":46,"searchOnlyMappings":4},"format":"refspec-vocabulary-atlas-nquads-1.0","generationDigest":"sha256:068e7beabc251631cb8f8285583e1e39237d02c0435db83360eb4b7d2e064d8a","graphs":[{"id":"urn:ref:vocabulary-atlas:068e7beabc251631cb8f8285583e1e39237d02c0435db83360eb4b7d2e064d8a:release-facts","quadCount":46,"role":"releaseFacts"},{"id":"urn:ref:vocabulary-atlas:068e7beabc251631cb8f8285583e1e39237d02c0435db83360eb4b7d2e064d8a:analysis","quadCount":475,"role":"analysis"}],"id":"urn:ref:vocabulary-atlas:068e7beabc251631cb8f8285583e1e39237d02c0435db83360eb4b7d2e064d8a","implementation":{"id":"urn:ref:implementation:vocabulary-atlas:1.0","runtime":{"jsonschemaVersion":"4.26.0","pyarrowVersion":"23.0.0","pythonRequirement":">=3.10","pythonVersion":"3.12.9","rdflibVersion":"7.6.0"},"sourceModules":[{"digest":"sha256:45fc1b96e41a57aa704f4397a2abb62039a68545e757c80fb0e932a09ee2dda2","path":"refspec/atlas/__init__.py"},{"digest":"sha256:4346f5bbddb5caf0581dddd3125e038239acac8d03d7ad0a5c69a6c59a08d372","path":"refspec/atlas/federal_register.py"},{"digest":"sha256:0da4b09f9e8858c43ce446fb9be8f06b115245bfab9f18c7d2af5a907071a45c","path":"refspec/atlas/icpsr.py"},{"digest":"sha256:219a4c99e7c130468081be2cb26dc36349d27047fc6aa590613e94a9160b75c9","path":"refspec/atlas/model.py"},{"digest":"sha256:dcdc918577b2a87f39d6b9d3ed28d1c877827174e979242affaf6df1d0216d89","path":"refspec/atlas/queries.py"},{"digest":"sha256:f6c7fc85e27852c124580969f9cbda6b5a7e7aa8502fbd4b9ea14867b95c130b","path":"refspec/binding.py"},{"digest":"sha256:9caed4aa1acd1aef685274b4c2dabee4f23dbae1d940a790612cf346f0f7f05a","path":"refspec/generated_rulespec_dependency.py"},{"digest":"sha256:639eb8483d3ffbac303ca07ef90aa76717e6ac2f6bfc993eea31873f6b025bcb","path":"refspec/immutable.py"},{"digest":"sha256:e60729e8ddbcf263866ac27788aaf6090da4d1cfddb3add02db5c9fa1eeda304","path":"refspec/managed_release.py"},{"digest":"sha256:817600bf20a9feae7a2b42a36b99b72693113fe7baf9a22fc670c31992ae0730","path":"refspec/registry/infrastructure/controlled_identifier.py"},{"digest":"sha256:7a6ec0bb4e39cd8ab469587ee1e82c38741a6ccc2324ee75b9c9c1ae06ac02c7","path":"refspec/registry/federal_register_thesaurus_2025.py"},{"digest":"sha256:2a48b4cc90be974f6cf35456a974bdae8b1ec6bb2ea1eeb8c4748cea8c6bb002","path":"refspec/registry/managed_releases/federal_register_thesaurus_2025_managed_release.py"},{"digest":"sha256:bb60e23d1f49bd66b2741d654a1fb2d89965579d4826405cb912f3b45dee655b","path":"refspec/policies/federal_register_lists_of_subjects.py"},{"digest":"sha256:14955a2d50b7957b95d6fbfcb69505920e265674f3a04764d89faaf8afb7d8a0","path":"refspec/registry/managed_releases/icpsr_managed_release.py"},{"digest":"sha256:035db15374070aa92398f21ef182da6050ab21dec81b1f4b4cf72596cb2c08d5","path":"refspec/registry/icpsr_subject.py"},{"digest":"sha256:9b1e638e963bcaf72e50b88b6c161316a4050946a6a612950ae29620a534766d","path":"refspec/release_graph.py"},{"digest":"sha256:223f47142e747dc2a8ea3bcb04264d1c313f58d42499490956403539b3a8839e","path":"refspec/storage.py"},{"digest":"sha256:74b969f71762060e5070c8e875cb16894c37494c9aa8e230e2fd9acfa7fae31a","path":"refspec/vocabulary.py"}],"version":"1.0"},"inputs":[{"manifestDigest":"sha256:1111111111111111111111111111111111111111111111111111111111111111","publicationReleaseId":"urn:ref:conformance:alpha-thesaurus:2026","role":"ManagedReleaseView","rulespecGraph":{"digest":"sha256:d167394ba5095f3589ec44d328e779598ac7a91446a1b801ea488cc92e70ca33","id":"urn:ref:conformance:alpha-thesaurus:2026:graph"}},{"manifestDigest":"sha256:2222222222222222222222222222222222222222222222222222222222222222","publicationReleaseId":"urn:ref:conformance:beta-thesaurus:2026","role":"ManagedReleaseView","rulespecGraph":{"digest":"sha256:f3b50bb5c2b03d6a00eed740f62685596b332472c7307a192330de0e40b2791a","id":"urn:ref:conformance:beta-thesaurus:2026:graph"}},{"fileDigest":"sha256:69fb95b1011f502bb528747d99c90a6594fb20048a2bfc0973936da03434da25","releaseDigest":"sha256:d4d9d6f1b7a1e290dbe12fcd12be4c00c233c00b741f2cb5b7f24f5b15ddd4b0","releaseId":"urn:rulespec:core:d4d9d6f1b7a1e290dbe12fcd12be4c00c233c00b741f2cb5b7f24f5b15ddd4b0","role":"RulespecCoreRelease"},{"digest":"sha256:91e562c0fd3bbaf9d293c2165e1098a0adf0690ee4734cfe1980a7ad93ba0337","fileDigest":"sha256:2290a2bf5ada08f7fc5f97471175b4e6c2668bc347d782f0cdd2054818707185","id":"urn:ref:vocabulary-atlas-crosswalk-bundle:0743b5cded32d8312771784a6687c51eba3f3bf6d8c8ad238dee95fd2bf43a2d","mediaType":"application/vnd.refspec.vocabulary-atlas-crosswalk+json","role":"CrosswalkBundle"}],"output":{"byteLength":166000,"digest":"sha256:c47986fc7320deff2443d816e15315bc0af65bcfc02ee74e1cf26a52778f330d","mediaType":"application/n-quads","path":"atlas.nq","quadCount":521},"policies":{"analysis":"replaceableMachineAnalysis","humanFeedback":"appendOnlyNonAuthorizing","labelEquality":"clusterOnly","mappingEligibility":"twoIndependentMachinesSearchOnly","releaseFacts":"copiedManagedReleaseFactsOnly"},"schemaVersion":"1.0","type":"urn:ref:type:VocabularyAtlasManifest"}
